{
  "$id": "agent-workflow-comparative-eval/decision-study-corpus/v1",
  "$schema": "https://json-schema.org/draft/2020-12/schema",
  "type": "object",
  "additionalProperties": false,
  "properties": {
    "schema": {"const": "agent-workflow-comparative-eval/decision-study-corpus/v1"},
    "study_id": {"type": "string", "minLength": 1},
    "dataset_version": {"type": "string", "minLength": 1},
    "cases": {"type": "array", "minItems": 1, "items": {"type": "object"}}
  },
  "required": ["schema", "study_id", "dataset_version", "cases"]
}
