{
  "cases": [
    {
      "case_id": "rsv1-001",
      "dataset_version": "routing-semantic-corpus-v2.0.0",
      "metadata": {
        "environment": "development",
        "requirements_state": "complete",
        "requires_interaction": false,
        "risk": "low",
        "task_type": "implementation"
      },
      "oracle_eligible": {
        "routing.interaction_required": true,
        "routing.semantic_risk": true,
        "routing.task_class": true
      },
      "schema": "agent-workflow-comparative-eval/decision-study-case/v1",
      "tags": [
        "clear-build",
        "clear",
        "single-intent",
        "declared-metadata"
      ],
      "task": "Add input validation to the JSON import endpoint and return field-specific errors."
    },
    {
      "case_id": "rsv1-002",
      "dataset_version": "routing-semantic-corpus-v2.0.0",
      "metadata": {
        "environment": "development",
        "requirements_state": "complete",
        "requires_interaction": false,
        "risk": "normal",
        "task_type": "implementation"
      },
      "oracle_eligible": {
        "routing.interaction_required": true,
        "routing.semantic_risk": true,
        "routing.task_class": true
      },
      "schema": "agent-workflow-comparative-eval/decision-study-case/v1",
      "tags": [
        "clear-build",
        "clear",
        "single-intent",
        "declared-metadata"
      ],
      "task": "Implement an LRU cache for parsed configuration files with a bounded entry count."
    },
    {
      "case_id": "rsv1-003",
      "dataset_version": "routing-semantic-corpus-v2.0.0",
      "metadata": {
        "environment": "development",
        "requirements_state": "complete",
        "requires_interaction": false,
        "risk": "normal",
        "task_type": "implementation"
      },
      "oracle_eligible": {
        "routing.interaction_required": true,
        "routing.semantic_risk": true,
        "routing.task_class": true
      },
      "schema": "agent-workflow-comparative-eval/decision-study-case/v1",
      "tags": [
        "clear-build",
        "clear",
        "single-intent",
        "declared-metadata"
      ],
      "task": "Add pagination support to the repository search API while preserving the existing response shape."
    },
    {
      "case_id": "rsv1-004",
      "dataset_version": "routing-semantic-corpus-v2.0.0",
      "metadata": {
        "environment": "development",
        "requirements_state": "complete",
        "requires_interaction": false,
        "risk": "normal",
        "task_type": "implementation"
      },
      "oracle_eligible": {
        "routing.interaction_required": true,
        "routing.semantic_risk": true,
        "routing.task_class": true
      },
      "schema": "agent-workflow-comparative-eval/decision-study-case/v1",
      "tags": [
        "clear-build",
        "clear",
        "single-intent",
        "declared-metadata"
      ],
      "task": "Implement idempotency keys for duplicate webhook deliveries in the local event processor."
    },
    {
      "case_id": "rsv1-005",
      "dataset_version": "routing-semantic-corpus-v2.0.0",
      "metadata": {
        "environment": "development",
        "requirements_state": "complete",
        "requires_interaction": false,
        "risk": "low",
        "task_type": "implementation"
      },
      "oracle_eligible": {
        "routing.interaction_required": true,
        "routing.semantic_risk": true,
        "routing.task_class": true
      },
      "schema": "agent-workflow-comparative-eval/decision-study-case/v1",
      "tags": [
        "clear-build",
        "clear",
        "single-intent",
        "declared-metadata"
      ],
      "task": "Add a command-line flag that emits the current configuration as sanitized JSON."
    },
    {
      "case_id": "rsv1-006",
      "dataset_version": "routing-semantic-corpus-v2.0.0",
      "metadata": {
        "environment": "development",
        "requirements_state": "complete",
        "requires_interaction": false,
        "risk": "normal",
        "task_type": "implementation"
      },
      "oracle_eligible": {
        "routing.interaction_required": true,
        "routing.semantic_risk": true,
        "routing.task_class": true
      },
      "schema": "agent-workflow-comparative-eval/decision-study-case/v1",
      "tags": [
        "clear-build",
        "clear",
        "single-intent",
        "declared-metadata"
      ],
      "task": "Implement retry backoff for transient database connection failures."
    },
    {
      "case_id": "rsv1-007",
      "dataset_version": "routing-semantic-corpus-v2.0.0",
      "metadata": {
        "environment": "development",
        "requirements_state": "complete",
        "requires_interaction": false,
        "risk": "normal",
        "task_type": "implementation"
      },
      "oracle_eligible": {
        "routing.interaction_required": true,
        "routing.semantic_risk": true,
        "routing.task_class": true
      },
      "schema": "agent-workflow-comparative-eval/decision-study-case/v1",
      "tags": [
        "clear-build",
        "clear",
        "single-intent",
        "declared-metadata"
      ],
      "task": "Add a migration that introduces a nullable display_name column and update the model mapping."
    },
    {
      "case_id": "rsv1-008",
      "dataset_version": "routing-semantic-corpus-v2.0.0",
      "metadata": {
        "environment": "development",
        "requirements_state": "complete",
        "requires_interaction": false,
        "risk": "normal",
        "task_type": "implementation"
      },
      "oracle_eligible": {
        "routing.interaction_required": true,
        "routing.semantic_risk": true,
        "routing.task_class": true
      },
      "schema": "agent-workflow-comparative-eval/decision-study-case/v1",
      "tags": [
        "clear-build",
        "clear",
        "single-intent",
        "declared-metadata"
      ],
      "task": "Implement CSV export for the existing filtered results view."
    },
    {
      "case_id": "rsv1-009",
      "dataset_version": "routing-semantic-corpus-v2.0.0",
      "metadata": {
        "environment": "development",
        "requirements_state": "complete",
        "requires_interaction": false,
        "risk": "low",
        "task_type": "implementation"
      },
      "oracle_eligible": {
        "routing.interaction_required": true,
        "routing.semantic_risk": true,
        "routing.task_class": true
      },
      "schema": "agent-workflow-comparative-eval/decision-study-case/v1",
      "tags": [
        "clear-build",
        "clear",
        "single-intent",
        "declared-metadata"
      ],
      "task": "Add a deterministic normalization step for user-supplied repository paths."
    },
    {
      "case_id": "rsv1-010",
      "dataset_version": "routing-semantic-corpus-v2.0.0",
      "metadata": {
        "environment": "development",
        "requirements_state": "complete",
        "requires_interaction": false,
        "risk": "normal",
        "task_type": "implementation"
      },
      "oracle_eligible": {
        "routing.interaction_required": true,
        "routing.semantic_risk": true,
        "routing.task_class": true
      },
      "schema": "agent-workflow-comparative-eval/decision-study-case/v1",
      "tags": [
        "clear-build",
        "clear",
        "single-intent",
        "declared-metadata"
      ],
      "task": "Implement a feature flag that disables the experimental parser without removing its code."
    },
    {
      "case_id": "rsv1-011",
      "dataset_version": "routing-semantic-corpus-v2.0.0",
      "metadata": {
        "environment": "development",
        "requires_interaction": false,
        "risk": "normal",
        "symptom_scope": "reproducible",
        "task_type": "research"
      },
      "oracle_eligible": {
        "routing.interaction_required": true,
        "routing.semantic_risk": true,
        "routing.task_class": true
      },
      "schema": "agent-workflow-comparative-eval/decision-study-case/v1",
      "tags": [
        "clear-diagnose",
        "clear",
        "single-intent",
        "declared-metadata"
      ],
      "task": "Investigate why the worker occasionally processes the same queued job twice and identify the likely failure path."
    },
    {
      "case_id": "rsv1-012",
      "dataset_version": "routing-semantic-corpus-v2.0.0",
      "metadata": {
        "environment": "development",
        "requires_interaction": false,
        "risk": "normal",
        "symptom_scope": "reproducible",
        "task_type": "exploratory"
      },
      "oracle_eligible": {
        "routing.interaction_required": true,
        "routing.semantic_risk": true,
        "routing.task_class": true
      },
      "schema": "agent-workflow-comparative-eval/decision-study-case/v1",
      "tags": [
        "clear-diagnose",
        "clear",
        "single-intent",
        "declared-metadata"
      ],
      "task": "Diagnose the source of a memory increase that appears after repeated document imports."
    },
    {
      "case_id": "rsv1-013",
      "dataset_version": "routing-semantic-corpus-v2.0.0",
      "metadata": {
        "environment": "development",
        "requires_interaction": false,
        "risk": "normal",
        "symptom_scope": "reproducible",
        "task_type": "research"
      },
      "oracle_eligible": {
        "routing.interaction_required": true,
        "routing.semantic_risk": true,
        "routing.task_class": true
      },
      "schema": "agent-workflow-comparative-eval/decision-study-case/v1",
      "tags": [
        "clear-diagnose",
        "clear",
        "single-intent",
        "declared-metadata"
      ],
      "task": "Trace why the CLI exits with code 0 even when one requested file cannot be parsed."
    },
    {
      "case_id": "rsv1-014",
      "dataset_version": "routing-semantic-corpus-v2.0.0",